{
  "schema_version": "1.0",
  "test_run_id": "tr-111",
  "draft_id": "draft-101",
  "ir_id": "ir-555",
  "status": "passed",
  "mock_inputs": {
    "user_id": "test-user-123"
  },
  "expected_outcomes": {
    "status": "sent"
  },
  "actual_outcomes": {
    "status": "sent"
  },
  "execution_time_ms": 145,
  "created_at": "2026-07-27T14:12:00Z"
}
